{"drand":{"chain_hash":"8990e7a9aaed2ffed73dbd7092123d6f289930540d7651336225dc172e51b2ce","client_version":"drand-client==1.4.2","genesis_time":1595431050,"group_hash":"176f93498eac9ca337150b46d21dd58673ea4e3581185f869672e59fa4cb390a","period":30,"scheme":"pedersen-bls-chained"},"node":{"contract_id":"node-roster-selection-v1","output_schema":"resampling-eligibility-manifest-v1","program_sha256":"2bc9154b4662176fedf42c20f75b31f2d4f1549f1d6a0777146f80112d41fae8","runtime":"nodejs-22"},"precommit_sha256":"0ec4db0d333efd5062684088859a4506aebb3f9a6a6a1ee992e9b771d20c20b3","public_key_ed25519_hex":"8bec051c2614356d4e25da7e2b1f5205ec68a1da45c62ea1a4ac0f73847f8de7","qualification_universe_sha256":"a887370640d2c6e9514e350c476e786d1040e6bcf3799422dee6c60b70944209","record_kind":"resampling_roster_ceremony_policy_v1","schema_version":"1","selection_program_sha256":"2bc9154b4662176fedf42c20f75b31f2d4f1549f1d6a0777146f80112d41fae8","sigstore":{"bundle_format":"sigstore-bundle-v0.3","contract_id":"sigstore-bundle-verification-v1","required_rekor_log":"rekor-public-good","verifier_source_sha256":"7b7531305f9b01f281e83037c550d62109c4b9bfd6f2cd148657aaaaab0e213c"},"study_id":"neurips-2026-resampling-null"}
